ID,Name,Age,Email,City,Bio
1,John Doe,28,john.doe@example.com,New York,"John Doe is a highly motivated software engineer based in New York. With a passion for technology and innovation, he has worked on several high-profile projects involving machine learning and artificial intelligence. John holds a degree in Computer Science and has experience in both startups and established tech companies. In his free time, he enjoys reading science fiction novels, coding personal projects, and hiking through the city’s numerous parks."
2,Jane Smith,34,jane.smith@example.com,Los Angeles,"Jane Smith is a seasoned marketing manager with over a decade of experience in the industry. Based in Los Angeles, she specializes in digital marketing strategies and brand management. Jane’s creative approach has helped numerous companies elevate their market presence. Outside of work, she loves traveling to new destinations, painting landscapes, and practicing yoga to maintain balance and creativity."
3,Bob Johnson,45,bob.johnson@example.com,Chicago,"Bob Johnson is a veteran lawyer with more than 20 years of experience specializing in corporate law and intellectual property rights. Based in Chicago, Bob is known for his analytical skills and dedication to his clients. He graduated from Harvard Law School and has a reputation for solving complex legal issues. In his leisure time, Bob enjoys cooking gourmet meals, fishing at local lakes, and gardening in his backyard."
4,Alice Brown,22,alice.brown@example.com,Houston,"Alice Brown is a recent college graduate with a degree in Marketing from the University of Texas. Based in Houston, she is eager to apply her skills in a dynamic work environment. Alice has interned with several companies, focusing on social media campaigns and market research. Her hobbies include photography, writing short stories, and running in her local park."
5,Charlie Davis,37,charlie.davis@example.com,Philadelphia,"Charlie Davis is an experienced project manager with a background in construction and real estate development. Living in Philadelphia, he is known for his organizational skills and ability to lead large teams through complex projects. Charlie holds a degree in Civil Engineering and enjoys the challenges of project management. In his free time, he plays guitar, goes camping with friends, and cycles around the city."
6,Emily Wilson,29,emily.wilson@example.com,Phoenix,"Emily Wilson is a financial analyst with a keen interest in economic trends and data analysis. Based in Phoenix, she works for a leading financial services firm where she provides insights to drive business decisions. Emily has a degree in Finance and is certified as a Chartered Financial Analyst (CFA). Her interests include traveling to different countries, reading historical novels, and maintaining a regular fitness routine."
7,David Clark,41,david.clark@example.com,San Antonio,"David Clark is a dedicated healthcare professional with a focus on patient care and medical research. Located in San Antonio, he has spent over 15 years working in various hospitals and clinics, helping to advance medical treatments and improve patient outcomes. David holds a Doctorate in Medicine and is passionate about healthcare innovation. His hobbies include playing tennis, hiking in nature reserves, and chess."
8,Olivia Lewis,26,olivia.lewis@example.com,San Diego,"Olivia Lewis is a talented graphic designer based in San Diego, known for her innovative designs and attention to detail. With a degree in Graphic Design from the Rhode Island School of Design, Olivia has worked on various branding and advertising projects. Her creative flair extends beyond her professional work into her personal life. She enjoys drawing, surfing along the Pacific coast, and experimenting with new recipes in the kitchen."
9,Michael Harris,33,michael.harris@example.com,Dallas,"Michael Harris is a dynamic sales executive with a strong track record in client relations and business development. Residing in Dallas, he has worked in various sectors, including technology and consumer goods. Michael has a background in Business Administration and excels in building strong client partnerships. Outside of work, he enjoys running marathons, playing golf on weekends, and watching the latest movies."
10,Emma Martin,31,emma.martin@example.com,San Jose,"Emma Martin is a creative content writer based in San Jose, specializing in crafting engaging and impactful content for various media platforms. With a degree in English Literature, Emma has worked with several publishing houses and digital media companies. Her passion for storytelling and writing shines through in her work. In her spare time, she enjoys yoga, exploring new travel destinations, and writing her own fiction."
11,James Lee,38,james.lee@example.com,Austin,"James Lee is a software developer with a strong background in programming and systems analysis. Based in Austin, he has contributed to several major tech projects, focusing on developing scalable applications and improving user interfaces. James has a degree in Computer Engineering and is known for his problem-solving skills. When he’s not coding, he likes to play video games, work on personal coding projects, and read science fiction."
12,Sophia Walker,27,sophia.walker@example.com,Jacksonville,"Sophia Walker is a human resources specialist who excels in recruitment, employee relations, and team development. Based in Jacksonville, she has worked with various organizations to improve their HR processes and employee satisfaction. Sophia holds a degree in Human Resources Management and is dedicated to fostering a positive work environment. Her interests include volunteering at local shelters, hiking in nearby trails, and experimenting with new recipes."
13,William Hall,40,william.hall@example.com,San Francisco,"William Hall is an innovative entrepreneur based in San Francisco, focusing on technology startups and business development. With a background in engineering and business management, William has successfully launched several tech ventures. He is known for his strategic thinking and leadership skills. In his personal time, William enjoys networking with industry peers, reading business literature, and playing basketball."
14,Isabella Allen,24,isabella.allen@example.com,Columbus,"Isabella Allen is a social media manager with a knack for creating engaging content and managing brand presence online. Living in Columbus, she has experience in running successful social media campaigns and analyzing digital metrics. Isabella graduated with a degree in Marketing and is passionate about the ever-evolving digital landscape. Her hobbies include traveling to exotic destinations, taking candid photographs, and exploring social media trends."
15,Ethan Young,36,ethan.young@example.com,Indianapolis,"Ethan Young is a seasoned operations manager with extensive experience in logistics and supply chain management. Based in Indianapolis, he oversees daily operations to ensure efficiency and productivity. Ethan holds a degree in Operations Management and enjoys optimizing processes. In his free time, he likes to engage in strategic board games, participate in community sports leagues, and explore local historical sites."
16,Charlotte King,32,charlotte.king@example.com,Denver,"Charlotte King is a skilled data analyst based in Denver, specializing in interpreting complex datasets to inform business strategies. With a degree in Statistics, Charlotte has a talent for uncovering insights that drive decision-making. Her analytical mindset and attention to detail make her a valuable asset in any project. In her personal life, Charlotte enjoys hiking the Rocky Mountains, participating in local trivia nights, and practicing yoga."
17,Oliver Wright,30,oliver.wright@example.com,Charlotte,"Oliver Wright is a digital marketer with a focus on SEO and content strategy. Based in Charlotte, he helps businesses improve their online visibility and engagement through targeted marketing efforts. Oliver has a degree in Marketing and a passion for digital trends. Outside of work, he enjoys experimenting with new digital tools, attending tech conferences, and playing guitar."
18,Ava Scott,25,ava.scott@example.com,Seattle,"Ava Scott is a talented UX designer who creates intuitive and user-friendly interfaces. Living in Seattle, she works for a tech firm where she applies her design skills to enhance user experiences. Ava has a degree in Design and is known for her creative solutions. Her hobbies include traveling to new cities, practicing yoga, and exploring Seattle’s vibrant food scene."
19,Lucas Green,39,lucas.green@example.com,Denver,"Lucas Green is a senior financial advisor with extensive experience in investment strategies and portfolio management. Based in Denver, he helps clients navigate their financial goals and make informed decisions. Lucas holds a degree in Finance and has earned several certifications. In his free time, he enjoys skiing in the Rockies, reading financial journals, and spending time with his family."
20,Mia Adams,27,mia.adams@example.com,Washington,"Mia Adams is a dynamic public relations specialist with a knack for crafting compelling narratives and managing media relations. Based in Washington, she works with clients to enhance their public image and handle crisis communications. Mia has a degree in Communications and is passionate about storytelling. Her hobbies include exploring local art galleries, volunteering for community events, and gardening."
21,Henry Baker,50,henry.baker@example.com,Boston,"Henry Baker is a distinguished professor of history with a focus on American colonial history. Residing in Boston, he has published several books and articles on the subject and enjoys teaching at the university level. Henry holds a PhD in History and is dedicated to education."
